{
  "$schema": "./effect-model.schema.json",
  "format_version": "1.0.0",
  "model_id": "php-native-effect-ownership-v1",
  "source_basis": [
    "Zend/Optimizer/zend_ssa.h:92-128",
    "Zend/zend_exceptions.c:155-227",
    "Zend/zend_execute.c:2904-2934",
    "Zend/zend_execute.h:137-220",
    "Zend/zend_execute_API.c:804-1060",
    "Zend/zend_gc.c:690-765",
    "Zend/zend_hash.c:822-900",
    "Zend/zend_object_handlers.c:63-70",
    "Zend/zend_objects.c:76-134",
    "Zend/zend_operators.c:1125-1158",
    "Zend/zend_variables.c:45-134",
    "Zend/zend_variables.h:29-57",
    "Zend/zend_vm_def.h:8222-8270",
    "ext/opcache/jit/zend_jit.c:300-340",
    "ext/opcache/jit/zend_jit_ir.c:1785-1835",
    "ext/opcache/jit/zend_jit_trace.c:166-218"
  ],
  "catalog": {
    "effects": ["read_memory", "write_memory", "allocate", "throw", "bailout", "call_internal", "call_php", "reenter_php", "run_destructor", "observe_frame", "interrupt_boundary", "suspend", "resume", "external_io", "terminate"],
    "memory_domains": ["frame.args", "frame.locals", "frame.temps", "frame.call_chain", "runtime.symbol_table", "runtime.cache", "heap.zval", "heap.array", "heap.object", "heap.string", "heap.reference", "gc.metadata", "engine.exception", "engine.observer", "engine.interrupt", "engine.class_table", "engine.function_table", "engine.generator", "engine.fiber", "external.state"],
    "ownership_states": ["uninitialized", "borrowed", "owned", "shared_owned", "moved", "released", "destroyed"],
    "ownership_actions": ["borrow", "copy_addref", "move", "produce_owned", "produce_borrowed", "transfer", "destroy", "conditional_destroy", "cow_separate", "canonicalize"],
    "predicates": ["may_run_destructor", "may_bailout", "may_reenter_php", "may_invoke_magic", "may_observe_frame", "may_interrupt", "may_suspend"],
    "barriers": ["safepoint", "reentrancy", "destructor", "exception", "bailout", "observer", "interrupt", "suspend"],
    "guard_facts": ["value_type", "object_class_identity", "refcount_unique", "array_packed_layout", "array_key_presence", "reference_binding", "runtime_cache_entry", "function_target", "class_table_entry", "no_exception_pending", "frame_slot_value", "destructor_absence"],
    "composition_rules": ["destructor_closure", "bailout_is_not_return", "php_call_closure", "unmodeled_internal_call", "magic_handler_closure", "observer_materialization", "interrupt_materialization", "suspension_materialization", "alias_write_invalidation", "exception_cleanup_order", "cow_is_visible"]
  },
  "unmodeled_semantics_policy": {
    "classification": "fail_closed",
    "pure": false,
    "optimization": "blocked",
    "publication": "rejected",
    "ownership": "rejected",
    "effects": ["read_memory", "write_memory", "allocate", "throw", "bailout", "call_internal", "call_php", "reenter_php", "run_destructor", "observe_frame", "interrupt_boundary", "suspend", "resume", "external_io", "terminate"],
    "reads": ["frame.args", "frame.locals", "frame.temps", "frame.call_chain", "runtime.symbol_table", "runtime.cache", "heap.zval", "heap.array", "heap.object", "heap.string", "heap.reference", "gc.metadata", "engine.exception", "engine.observer", "engine.interrupt", "engine.class_table", "engine.function_table", "engine.generator", "engine.fiber", "external.state"],
    "writes": ["frame.args", "frame.locals", "frame.temps", "frame.call_chain", "runtime.symbol_table", "runtime.cache", "heap.zval", "heap.array", "heap.object", "heap.string", "heap.reference", "gc.metadata", "engine.exception", "engine.observer", "engine.interrupt", "engine.class_table", "engine.function_table", "engine.generator", "engine.fiber", "external.state"],
    "barriers": ["safepoint", "reentrancy", "destructor", "exception", "bailout", "observer", "interrupt", "suspend"]
  },
  "atomic_effects": [
    {"id":"read_memory","definition":"Read semantic state from one or more named domains.","observable_behavior":"The value read constrains reordering with aliasing writes.","conservative_default":"Assume every registered domain is read when a summary is absent.","source_refs":["Zend/zend_execute.h:137-162"],"reads":["heap.zval"],"writes":[],"barriers":[]},
    {"id":"write_memory","definition":"Change semantic state in one or more named domains.","observable_behavior":"Aliasing reads and guards can observe the change.","conservative_default":"Assume every registered domain is written when a summary is absent.","source_refs":["Zend/zend_hash.c:822-900"],"reads":[],"writes":["heap.zval"],"barriers":[]},
    {"id":"allocate","definition":"Allocate engine-managed storage or a value container.","observable_behavior":"Allocation may affect GC metadata and may fail through engine control flow.","conservative_default":"Treat allocation as a heap and GC write with a safepoint.","source_refs":["Zend/zend_gc.c:690-765"],"reads":["gc.metadata"],"writes":["heap.zval","gc.metadata"],"barriers":["safepoint"]},
    {"id":"throw","definition":"Create, replace, or propagate the active exception.","observable_behavior":"Control transfers to exception handling after ordered cleanup.","conservative_default":"Assume an operation may throw unless a totality proof excludes it.","source_refs":["Zend/zend_exceptions.c:155-227"],"reads":["engine.exception","frame.call_chain"],"writes":["engine.exception","frame.call_chain"],"barriers":["exception","safepoint"]},
    {"id":"bailout","definition":"Perform a non-local engine bailout.","observable_behavior":"The current continuation has no normal return.","conservative_default":"Treat possible bailout as a terminal control-flow edge.","source_refs":["Zend/zend_exceptions.c:184-190","ext/opcache/jit/zend_jit.c:3090-3132"],"reads":["frame.call_chain"],"writes":["frame.call_chain"],"barriers":["bailout","safepoint"]},
    {"id":"call_internal","definition":"Invoke an internal function or handler.","observable_behavior":"The callee can mutate engine state or delegate to PHP.","conservative_default":"Use the fail-closed summary until a validated callee summary exists.","source_refs":["Zend/zend_execute_API.c:1020-1052"],"reads":["frame.args","runtime.cache"],"writes":["frame.temps"],"barriers":["safepoint"]},
    {"id":"call_php","definition":"Invoke PHP code with a Zend-compatible call frame.","observable_behavior":"Arbitrary user-visible effects, throws, and frame observation may occur.","conservative_default":"Assume reentry, throw, observation, and aliasing reads and writes.","source_refs":["Zend/zend_execute_API.c:990-1018"],"reads":["frame.args","frame.locals","runtime.symbol_table","heap.zval"],"writes":["frame.temps","runtime.symbol_table","heap.zval","engine.exception"],"barriers":["safepoint","reentrancy","exception","observer"]},
    {"id":"reenter_php","definition":"Enter PHP while another engine action remains active.","observable_behavior":"User code can inspect frames and mutate aliases before the outer action completes.","conservative_default":"Assume arbitrary PHP behavior and require materialization.","source_refs":["Zend/zend_objects.c:113-134"],"reads":["frame.args","frame.locals","frame.call_chain","heap.zval"],"writes":["frame.temps","heap.zval","engine.exception"],"barriers":["reentrancy","safepoint","exception","observer"]},
    {"id":"run_destructor","definition":"Run value or object destruction logic.","observable_behavior":"Destruction can execute PHP, throw, observe frames, and trigger GC.","conservative_default":"Assume full destructor closure unless exact type proof excludes it.","source_refs":["Zend/zend_objects.c:76-134","Zend/zend_variables.c:45-83"],"reads":["heap.zval","heap.object","gc.metadata"],"writes":["heap.zval","heap.object","gc.metadata","engine.exception"],"barriers":["destructor","reentrancy","exception","observer","safepoint"]},
    {"id":"observe_frame","definition":"Expose interpreter-visible frame state to an observer or user code.","observable_behavior":"Arguments, locals, temporaries, and call-chain position become observable.","conservative_default":"Materialize the full visible frame before observation.","source_refs":["Zend/zend_execute_API.c:990-1018"],"reads":["frame.args","frame.locals","frame.temps","frame.call_chain"],"writes":["engine.observer"],"barriers":["observer","safepoint"]},
    {"id":"interrupt_boundary","definition":"Poll or dispatch engine interruption.","observable_behavior":"Callbacks or termination can occur at this ordering point.","conservative_default":"Treat the boundary as frame-observing and control-flow changing.","source_refs":["Zend/zend_execute_API.c:990-1018"],"reads":["engine.interrupt","frame.call_chain"],"writes":["engine.interrupt"],"barriers":["interrupt","safepoint","observer"]},
    {"id":"suspend","definition":"Suspend generator or fiber execution.","observable_behavior":"Live frame and ownership state persist until resumption.","conservative_default":"Materialize all live state and forbid motion across suspension.","source_refs":["Zend/zend_vm_def.h:8442-8490"],"reads":["frame.args","frame.locals","frame.temps","engine.generator","engine.fiber"],"writes":["engine.generator","engine.fiber"],"barriers":["suspend","safepoint"]},
    {"id":"resume","definition":"Resume a suspended generator or fiber.","observable_behavior":"Previously materialized state becomes active under current engine state.","conservative_default":"Reload and revalidate all cross-suspension facts.","source_refs":["Zend/zend_vm_def.h:8442-8490"],"reads":["engine.generator","engine.fiber"],"writes":["frame.locals","frame.temps"],"barriers":["suspend","safepoint"]},
    {"id":"external_io","definition":"Read or change state outside engine-managed memory.","observable_behavior":"Other processes or subsequent operations can observe ordering.","conservative_default":"Preserve program order around external state.","source_refs":["Zend/zend_execute_API.c:1020-1052"],"reads":["external.state"],"writes":["external.state"],"barriers":["safepoint"]},